Person ID,First Name,Last Name,Email,Title,Organization,Phone,Profile Photo,Linkedin URL,Twitter URL,Groups,Bio
01GRVMG0Z6CGJD8ATXD6AVZAVE,Chen,Albutt,calbutt0@sun.com,Research Associate,Hahn-Watsica,+7 991 795 7708,,https://chicagotribune.com/sapien/in/sapien/iaculis.png,https://netvibes.com/ut/odio/cras/mi.xml,,"Integer tincidunt ante vel ipsum. Praesent blandit lacinia erat. Vestibulum sed magna at nunc commodo placerat.

Praesent blandit. Nam nulla. Integer pede justo, lacinia eget, tincidunt eget, tempus vel, pede.

Morbi porttitor lorem id ligula. Suspendisse ornare consequat lectus. In est risus, auctor sed, tristique in, tempus sit amet, sem."
01GRVMG0ZCGDXVE5BQTD69KTE3,Horatio,Dogerty,hdogerty1@cocolog-nifty.com,Operator,"Funk, Huels and Wolf",+33 594 687 2746,,http://usnews.com/pellentesque/quisque/porta/volutpat/erat/quisque/erat.png,http://mozilla.com/at/nulla/suspendisse.json,Group1,"Aenean fermentum. Donec ut mauris eget massa tempor convallis. Nulla neque libero, convallis eget, eleifend luctus, ultricies eu, nibh.

Quisque id justo sit amet sapien dignissim vestibulum. Vestibulum ante ipsum primis in faucibus orci luctus et ultrices posuere cubilia Curae; Nulla dapibus dolor vel est. Donec odio justo, sollicitudin ut, suscipit a, feugiat et, eros.

Vestibulum ac est lacinia nisi venenatis tristique. Fusce congue, diam id ornare imperdiet, sapien urna pretium nisl, ut volutpat sapien arcu sed augue. Aliquam erat volutpat."
01GRVMG0ZH31V7P0FHT1V4GP4G,Jamill,Verrier,jverrier2@ovh.net,Compensation Analyst,Zieme Inc,+63 898 110 6742,,https://usa.gov/sem.xml,https://wikimedia.org/ut/erat.js,"Group2, Group 3","Curabitur gravida nisi at nibh. In hac habitasse platea dictumst. Aliquam augue quam, sollicitudin vitae, consectetuer eget, rutrum at, lorem.

Integer tincidunt ante vel ipsum. Praesent blandit lacinia erat. Vestibulum sed magna at nunc commodo placerat.

Praesent blandit. Nam nulla. Integer pede justo, lacinia eget, tincidunt eget, tempus vel, pede."
01GRVMG0ZQK3QCBEM8EFPD59JC,Zia,Lawrey,zlawrey3@wikipedia.org,Librarian,Dooley-Schultz,+420 585 839 9331,pexels-kebs-visuals-3992656-e1675372824980.jpg,http://reddit.com/sed/augue/aliquam/erat.html,http://techcrunch.com/accumsan/odio/curabitur.aspx,,"Cum sociis natoque penatibus et magnis dis parturient montes, nascetur ridiculus mus. Vivamus vestibulum sagittis sapien. Cum sociis natoque penatibus et magnis dis parturient montes, nascetur ridiculus mus.

Etiam vel augue. Vestibulum rutrum rutrum neque. Aenean auctor gravida sem."
01GRVMG0ZW0RH709VJQJYVNJWV,Christina,Kilborn,ckilborn4@jimdo.com,Civil Engineer,Hoeger-Mayert,+48 724 744 0863,,https://tripod.com/quisque.html,http://nhs.uk/rhoncus/mauris/enim/leo.json,,"Aenean lectus. Pellentesque eget nunc. Donec quis orci eget orci vehicula condimentum.

Curabitur in libero ut massa volutpat convallis. Morbi odio odio, elementum eu, interdum eu, tincidunt in, leo. Maecenas pulvinar lobortis est."
01GRVMG101A995WSG4VTJANYP8,Binnie,Oxenham,boxenham5@reference.com,Dental Hygienist,Ritchie Inc,+62 228 188 8002,,https://sina.com.cn/sed/lacus/morbi/sem.jpg,https://google.com.br/nam/congue/risus/semper/porta/volutpat/quam.jsp,,"Morbi non lectus. Aliquam sit amet diam in magna bibendum imperdiet. Nullam orci pede, venenatis non, sodales sed, tincidunt eu, felis.

Fusce posuere felis sed lacus. Morbi sem mauris, laoreet ut, rhoncus aliquet, pulvinar sed, nisl. Nunc rhoncus dui vel sem."
01GRVMG107S5ZVQ5ZWR32WAK1F,Sisile,Coddington,scoddington6@cyberchimps.com,Programmer Analyst III,Dare-Kub,+7 975 367 7668,,https://google.com.br/libero/convallis/eget.xml,http://furl.net/vestibulum/proin/eu/mi/nulla/ac.png,,"Phasellus sit amet erat. Nulla tempus. Vivamus in felis eu sapien cursus vestibulum.

Proin eu mi. Nulla ac enim. In tempor, turpis nec euismod scelerisque, quam turpis adipiscing lorem, vitae mattis nibh ligula nec sem.

Duis aliquam convallis nunc. Proin at turpis a pede posuere nonummy. Integer non velit."
01GRVMG10BW9MSJDC0BF7Q5WPZ,Greg,Duligall,gduligall7@pinterest.com,Biostatistician I,Waters-Baumbach,+7 403 563 6158,,http://auda.org.au/augue/vestibulum/ante/ipsum/primis/in/faucibus.aspx,http://dedecms.com/diam/cras.jsp,,"Curabitur gravida nisi at nibh. In hac habitasse platea dictumst. Aliquam augue quam, sollicitudin vitae, consectetuer eget, rutrum at, lorem."
01GRVMG10FN60GDHE6Y2ZC1PZ3,Gaspard,Kloisner,gkloisner8@ovh.net,Financial Advisor,Schiller LLC,+66 857 750 3151,,http://zdnet.com/justo/nec/condimentum.html,https://deliciousdays.com/nisi/at/nibh/in/hac/habitasse.png,Group1,"Duis consequat dui nec nisi volutpat eleifend. Donec ut dolor. Morbi vel lectus in quam fringilla rhoncus.

Mauris enim leo, rhoncus sed, vestibulum sit amet, cursus id, turpis. Integer aliquet, massa id lobortis convallis, tortor risus dapibus augue, vel accumsan tellus nisi eu orci. Mauris lacinia sapien quis libero."
01GRVMG10M48BY7FR3MM7XP5YJ,Charmain,Feldmus,cfeldmus9@gizmodo.com,Mechanical Systems Engineer,"Wisozk, Langworth and Sauer",+54 902 176 4597,,http://hexun.com/lacinia.json,http://amazon.co.uk/fusce/lacus/purus/aliquet/at/feugiat.xml,,"Aenean fermentum. Donec ut mauris eget massa tempor convallis. Nulla neque libero, convallis eget, eleifend luctus, ultricies eu, nibh."
